{
  "$schema": "http://json-schema.org/draft-07/schema#",
  "$id": "https://raw.githubusercontent.com/DSB-117/brainblast/main/schema/report.schema.json",
  "title": "Brainblast Research Report",
  "description": "Machine-readable emission written alongside final-report.md. Stable, versioned surface that tools and CI gates target instead of parsing prose.",
  "type": "object",
  "additionalProperties": false,
  "required": ["schemaVersion", "run", "summary", "components", "riskTotals"],
  "properties": {
    "schemaVersion": {
      "description": "Schema contract version. Consumers should reject a major they do not understand.",
      "type": "string",
      "const": "1.0"
    },
    "run": {
      "type": "object",
      "additionalProperties": false,
      "required": ["id", "date", "requirements"],
      "properties": {
        "id": { "type": "string", "description": "Run directory id, e.g. 20260604-120000." },
        "date": { "type": "string", "format": "date" },
        "requirements": { "type": "string", "description": "One-line summary of what is being built." },
        "generator": { "type": "string", "description": "Tool + version that produced the report." }
      }
    },
    "summary": {
      "type": "object",
      "additionalProperties": false,
      "required": ["building", "verdict"],
      "properties": {
        "building": { "type": "string" },
        "verdict": { "type": "string", "enum": ["ready", "caution", "blocked"] },
        "topRisk": { "type": ["string", "null"] },
        "mustDecideFirst": { "type": ["string", "null"] },
        "watchOutFor": { "type": ["string", "null"] }
      }
    },
    "components": {
      "type": "array",
      "items": {
        "type": "object",
        "additionalProperties": false,
        "required": ["name", "type", "version", "status", "risks"],
        "properties": {
          "name": { "type": "string" },
          "type": { "type": "string", "enum": ["API", "SDK", "Auth", "Database", "Infra", "Blockchain", "Other"] },
          "version": { "type": "string", "description": "Resolved version, or 'unversioned'." },
          "sourceUrl": { "type": ["string", "null"] },
          "status": { "type": "string", "enum": ["fresh", "cached", "partial", "not_found"] },
          "risks": {
            "type": "array",
            "items": {
              "type": "object",
              "additionalProperties": false,
              "required": ["severity", "title"],
              "properties": {
                "severity": { "type": "string", "enum": ["critical", "high", "medium", "low"] },
                "title": { "type": "string" },
                "detail": { "type": "string" },
                "advisoryId": { "type": "string", "description": "OSV advisory ID (e.g. GHSA-xxxx-xxxx-xxxx or CVE-YYYY-NNNNN) for risks sourced from the OSV cross-check." },
                "advisoryUrl": { "type": "string", "description": "Link to the advisory, e.g. https://osv.dev/vulnerability/<id>." },
                "evidence": {
                  "type": "object",
                  "description": "Source-grounded proof for the risk finding. Captures the exact quote from official docs/changelogs that substantiates the risk, so the finding is verifiable rather than inferred.",
                  "additionalProperties": false,
                  "required": ["quote", "url"],
                  "properties": {
                    "quote": { "type": "string", "description": "Verbatim sentence or code snippet from the source that proves this risk exists." },
                    "url": { "type": "string", "description": "URL of the page where the quote was found." },
                    "browsedAt": { "type": "string", "format": "date", "description": "ISO date the source was accessed." }
                  }
                }
              }
            }
          }
        }
      }
    },
    "riskTotals": {
      "type": "object",
      "additionalProperties": false,
      "required": ["critical", "high", "medium", "low"],
      "description": "Counts across all component risks. MUST equal the sum of every component's risks by severity.",
      "properties": {
        "critical": { "type": "integer", "minimum": 0 },
        "high": { "type": "integer", "minimum": 0 },
        "medium": { "type": "integer", "minimum": 0 },
        "low": { "type": "integer", "minimum": 0 }
      }
    },
    "preCodingDecisions": {
      "type": "array",
      "items": {
        "type": "object",
        "additionalProperties": false,
        "required": ["title"],
        "properties": {
          "title": { "type": "string" },
          "detail": { "type": "string" },
          "immutable": { "type": "boolean", "description": "True if the choice cannot be changed after deploy." }
        }
      }
    },
    "requirementsCorrections": {
      "type": "array",
      "items": {
        "type": "object",
        "additionalProperties": false,
        "required": ["kind", "detail"],
        "properties": {
          "kind": { "type": "string", "enum": ["missing_constraint", "wrong_assumption", "underspecified", "immutable_choice"] },
          "detail": { "type": "string" }
        }
      }
    },
    "openQuestions": {
      "type": "array",
      "description": "Questions that could not be resolved from public sources.",
      "items": { "type": "string" }
    },
    "checks": {
      "type": "array",
      "description": "Per-rule verification results from the deterministic auditor (npx brainblast). Each entry is one rule checked against the implementation.",
      "items": {
        "type": "object",
        "additionalProperties": false,
        "required": ["ruleId", "severity", "result", "title"],
        "properties": {
          "ruleId": { "type": "string" },
          "severity": { "type": "string", "enum": ["critical", "high", "medium", "low"] },
          "result": { "type": "string", "enum": ["pass", "fail", "cant_tell"] },
          "file": { "type": ["string", "null"] },
          "line": { "type": ["integer", "null"], "minimum": 0 },
          "title": { "type": "string" },
          "detail": { "type": "string" }
        }
      }
    },
    "checkTotals": {
      "type": "object",
      "additionalProperties": false,
      "required": ["pass", "fail", "cant_tell"],
      "description": "Counts across all checks by result. MUST equal the count of checks[] by result.",
      "properties": {
        "pass": { "type": "integer", "minimum": 0 },
        "fail": { "type": "integer", "minimum": 0 },
        "cant_tell": { "type": "integer", "minimum": 0 }
      }
    },
    "costAnalysis": {
      "type": ["object", "null"],
      "description": "Additive cost & rent analysis (npx brainblast). Does not affect the security verdict."
    },
    "walletConfig": {
      "type": ["object", "null"],
      "description": "Additive Wallet Guard analysis (v0.8.3): declared network vs wallet-adapter wiring. Surfaced in the default run but does NOT affect checks[]/checkTotals or the security verdict; gate explicitly with --fail-on-wallet."
    }
  }
}
